계열,관련 학과,일반 선택,진로 선택,멘토의 한 마디
정보보안학과,"해킹이나 개인정보의 유출, 암호화폐 등은 정보시스템에 대한 다양한 해킹 및 전자적 침해 행위를 대비하고, 전자거래에서 개인 및 거래정보의 안전한 전달을 보장하는 보안전문가 양성을 목표로 설립된 학과이다.","* 코딩에 관심이 있으며 정보를 분석하고 해석하는 것에 적성과 흥미가 있는 학생 
* 새로운 분야에 적극적으로 도전할 수 있는 용기를 가진 학생
* 사이버윤리에 대하여 공감하며 다양한 소통역량을 가진 학생","스마트보안학부, 정보보안암호수학과, 사이버보안학과, 사이버보안전공, 융합보안학과, 정보보호학과, 산업보안학과 등","고려대, 국민대, 덕성여대, 동국대, 서울여대, 성신여대, 세종대, 이화여대, 중앙대, 한성대 등","경기대, 단국대, 아주대, 한세대 등","경남대, 상명대(천안) 등","IT기업, 정부 및 군경 보안관련 공무원, 학계 및 연구기관 연구원 등","화법과 작문, 독서, 언어와 매체, 문학","수학Ⅰ, 수학Ⅱ, 확률과 통계, 기하, 수학과제탐구","영어 회화, 영어Ⅰ, 영어 독해와 작문, 영어Ⅱ","정치와 법, 생활과 윤리","물리학Ⅰ, 물리학Ⅱ, 융합과학","정보, 인공지능 기초",,,,,,,,,,,,,
융합학과,융합학과는 창의 융합형 인재를 육성하고자 한다. 다양한 학과가 서로 융합되어 구성된다는 특징이 있으며 인공지능과 융합된 학과가 많은 편이다.,"* 다양한 전공의 진로를 설계하고 있는 학생
* 다양한 전공을 ICT계열 및 AI관련분야와 융합하고자 하는 학생
* 하나의 전공분야의 틀에 고정되기 보다는 다양한 학문적 경험을 하고자 하는 학생
* 새로운 분야를 개척하고자 하는 도전의식이 있는 학생","융합인재학과, 융합전자공학부, 융합에너지공학과, 가상증강현실융합학과, 의생명융합공학부, SW융합학부, 융합응용화학과, 글로벌융합학부, 화학에너지융합학부, 바이오헬스융합학부, 스마트생명산업융합학과. IT융합학부, 융합콘텐츠학과, 융합보건학과, IT금융학과, 융합공학부, 생명정보융합학과, 스마트융합공학부 등","건국대, 동덕여대, 상명대, 서울시립대, 성균관대, 성신여대, 세종대, 숭실대, 중앙대 등","안양대, 평택대, 한경대 등","충남대, 경남과기대, 한남대, 부산대, 울산대, 전주대, 남서울대 등",4차 산업혁명시대에 적합한 인재상으로 사회 각 분야의 전문가로 진출,"화법과 작문, 독서, 언어와 매체, 문학","수학Ⅰ, 수학Ⅱ, 확률과 통계, 수학과제탐구","영어 회화, 영어Ⅰ, 영어 독해와 작문, 영어Ⅱ",사회문제탐구,생활과 과학,"정보, 인공지능 기초",,,,,,,,,,,,,

과목명,구분,특성,수능 출제 여부,관련 인증 및 자격증,관련학과,관련직업,선생님의 한 마디,내용 체계,평가정보
화법과 작문,일반선택,"'국어'의 듣기/말하기 영역과 쓰기 영역을 심화/확장한 과목으로, 다양한 주제와 유형의 담화, 글을 바탕으로 하여 의미를 구성하고 효과적으로 소통하는 능력을 기르는 데 목적을 둔다. ",수능 선택,"국어능력인증, KBS한국어능력검정, 한국어교육능력검정, 한국어교원자격증, 한국실용 글쓰기검정 등","국어국문학과, 국어교육학과, 통번역학과, 광고홍보학과, 신문방송학과, 미디어커뮤니케이션학과, 언어학과, 문예창작과, 문헌정보학과 등","언론인, 작가, 언어학연구원, 방송작가, 상담 전문가, 출판물편집자, 카피라이터, 평론가, 프로듀서, 통역사 등","다양한 주제 및 유형의 담화와 글을 접하고, 능동적이고 효과적으로 소통하는 능력과 바람직한 의사소통의 태도를 익힐 수 있다. 자신의 생각을 적절한 표현 전략과 전달 방법을 활용해 말이나 글로 생산하면서 대학 진학 이후에도 발표나 토론, 보고서 쓰기 등 공식적 상황에 필요한 의사소통 능력을 키우는 데 도움이 되는 과목이다. ","● 화법과 작문의 본질 (자아 인식, 대인 관계, 사회적 상호 작용)
● 화법의 원리와 실제 (화법의 구성 요소, 담화의 맥락, 담화의 유형, 화법의 전략, 화법의 표현과 전달 방법)
● 작문의 원리와 실제 (작문의 구성 요소, 작문의 맥락, 글의 유형, 작문의 전략, 작문의 표현과 전달 방법)
● 화법과 작문의 태도 (배려·공감, 진정성·책임감)",성취도 5단계/등급 산출
독서,일반선택,"‘국어’의 읽기 영역을 심화/확장한 과목으로, 다양한 주제와 유형의 글을 폭넓게 읽어 삶을 풍부하게 하는 데 목적이 있다.",수능 필수,"국어능력인증, KBS한국어능력검정, 한국어교육능력검정, 한국어교원자격증, 한국실용글쓰기검정 등","국어국문학과, 국어교육학과, 신문방송학과, 미디어커뮤니케이션학과, 언어학과, 문예창작과, 문헌정보학과, 독서문화콘텐츠학과 등","언론인, 중등교사, 독서지도사, 출판물편집자, 평론가, 프로듀서, 통역사, 문헌학자 등","다양한 분야의 독서 경험을 통해 비판적이고 창의적인 독서 능력을 기를 수 있다. 자아와 타인에 대한 이해를 넓히고 글을 읽는 목적에 따라 스스로 책을 찾아 읽는 독자로서의 소양을 갖추고, 학습에 필요한 배경 지식과 역량을 기를 수 있다.","● 독서의 본질 (글과 독서의 가치, 상호 텍스트성)
● 독서의 방법 (사실적 이해, 추론적 이해, 비판적 이해, 감상적 이해, 창의적 이해)
● 독서의 분야 (교양 독서, 매체 읽기)
● 독서의 태도 (독서 계획, 독서 활동)",성취도 5단계/등급 산출
언어와 매체,일반선택,"'국어'의 음성 언어 , 문자 언어 , 매체 언어 등 실제 생활에서 접할 수 있는 언어의 본질을 이해하고 이를 실제 의사소통에 통합적으로 활용하는 능력과 태도를 기르는 데 목적을 둔다.",수능 선택,"국어능력인증, KBS한국어능력검정, 한국어교육능력검정, 한국어교원자격증, 한국실용글쓰기검정 등 ","국어국문학과, 국어교육학과, 신문방송학과, 미디어커뮤니케이션학과, 언어학과, 문예창작과, 광고홍보학과, 신문방송학과, 문헌정보학과 등","언론인, 중등교사, 작가, 언어학연구원, 언어 치료사, 방송작가, 소설가, 시인, 영화시나리오 작가, 출판물편집자, 카피라이터, 평론가, 프로듀서, 통역사 등","정확한 언어 사용을 위한 국어 문법의 체계와 특징을 공부하고, 현대 사회의 의사소통에서 비중이 높아지는 매체 자료를 비판적으로 수용하거나 창의적으로 의미를 구성하는 능력을 기를 수 있다.  ","● 언어와 매체의 본질 (언어와 인간, 매체와 소통)
● 국어의 탐구와 활용 (음운·단어·문장·담화, 국어 자료의 다양성)
● 매체 언어의 탐구와 활용 (인쇄 매체, 전자 매체, 대중 매체, 복합 양식성)
● 언어와 매체에 관한 태도 (국어생활, 매체 문화)",성취도 5단계/등급 산출
문학,일반선택,"'국어'의 문학 영역을 심화/확장한 과목으로, 문학과 관련한 다양한 활동을 바탕으로 문학 작품을 창작/감상하는 능력을 기르고 문학에 대한 소양과 태도를 기르는 데 목적을 두고 있다. ",수능 필수,"국어능력인증, KBS한국어능력검정, 한국어교육능력검정, 한국어교원자격증, 한국실용글쓰기검정 등","문예창작과, 국어국문학과, 국어교육학과, 영어영문학과, 불어불문학과, 독어독문학과, 노어노문학과, 중어중문학과, 일어일문학과, 통번역학과, 언어학과, 신문방송학과, 미디어커뮤니케이션학과, 문헌정보학과 등","시인, 소설가, 극작가, 방송작가, 영화 시나리오 작가, 평론가, 인문사회 계열 교수, 언론인, 중등교사, 언어학연구원, 출판물편집자, 카피라이터, 프로듀서, 통역사 등","인간의 삶과 불가분의 관계에 있는 언어 예술로서 문학이 지니는 가치/역사/체계에 대한 이해, 작가 또는 독자의 위치에서 참여하는 문학 활동, 다양한 맥락 속에서 문학이 향유되는 과정 등을 직간접적으로 경험할 수 있다.","● 문학의 본질 (언어 예술, 진·선·미)
● 문학의 수용과 생산 (문학 능력, 문학문화, 작가와 독자, 문학의 확장, 작품의 내재적·외재적 요소)
● 한국 문학의 성격과 역사 (한국 문학, 문학사와 역사적 갈래, 문학과 사회·문화)
● 문학에 대한 태도 (자아 성찰, 타자의 이해와 소통, 문학의 생활화)",성취도 5단계/등급 산출
실용 국어,진로선택,'국어'에서 학습한 결과를 바탕으로 일상 생활 및 직업 생활에서 업무를 수행하는 데 필요한 능력을 기르는 데 목적을 두고 있는 진로 선택 과목이다.,수능 출제 과목 아님,"국어능력인증, KBS한국어능력검정, 한국어교육능력검정, 한국어교원자격증, 한국실용글쓰기검정 등","신문방송학과, 미디어커뮤니케이션학과, 언어학과, 광고홍보학과","언론인, 인문사회계열 교수, 중등교사, 작가","취업을 목표로 하는 학습자를 대상으로 하여 취업과 관련하여 업무 수행을 위해 말이나 글, 자료 등을 정확하게 이해하고 맥락에 따라 자신의 의사를 효과적으로 전달하는 방법을 기르는 데 중점을 두고 있다. ","● 직무 어휘와 어법 (어휘 선턱, 문장 작성)
● 정보의 해석과 조직 (정보 해석, 정보 조직)
● 설득과 협력적 문제 해결 (설득, 의사 결정, 문제 해결, 갈등 관리)
● 대인 관계와 의사소통 (대인 관계, 언어 예절)
● 문화와 교양 (의사소통 문화, 자아 성찰, 교양 함양)",성취도 3단계/등급 미산출
심화 국어,진로선택,'국어'에서 학습한 결과를 바탕으로 심화된 학문 탐구 능력을 향상시키기 위한 진로 선택 과목이다. ,수능 출제 과목 아님,"국어능력인증, KBS한국어능력검정, 한국어교육능력검정, 한국어교원자격증, 한국실용글쓰기검정 등","국어국문학과, 국어교육학과, 문예창작과, 신문방송학과, 미디어커뮤니케이션학과, 언어학과, 광고홍보학과, 문헌정보학과 등","학자, 언론인, 중등교사, 작가, 연구원, 평론가, 프로듀서, 통역사 등","대학교에 진학하여 자신이 선택한 전공 분야의 전문적 내용을 학습하기 위해 필요한 능력들, 즉 폭넓은 사고력, 언어적 사고력, 깊이 있는 이해 및 표현 능력 등을 기름으로써 원활한 학업 수행이 이루어지도록 하는 데에 중점을 두는 과목이다. ","● 논리적 사고와 의사소통 (논리적 사고, 정보 활용, 정보 소통)
● 비판적 사고와 문제 해결 (비판적 사고, 의사 결정, 문제 해결)
● 창의적 사고와 문화 활동 (창의적 사고, 언어 예술, 언어 공동체)
● 윤리적 사고와 학문 활동 (윤리적 사고, 학문 탐구 자세)",성취도 3단계/등급 미산출
고전 읽기,진로선택,'국어'에서 학습한 결과를 바탕으로 다양한 고전을 읽으며 보다 수준 높은 교양을 갖추고 다양한 분야의 진로에 필요한 지혜와 소양을 기르는 데 목적을 둔다. ,수능 출제 과목 아님,"국어능력인증, KBS한국어능력검정, 한국어교육능력검정, 한국어교원자격증, 한국실용글쓰기검정 등","국어국문학과, 국어교육학과, 한문학과, 철학과, 신문방송학과, 미디어커뮤니케이션학과, 언어학과, 문헌정보학과 등","언론인, 중등교사, 인문사회 계열 교수, 연구원, 번역가, 작가, 학예사, 평론가, 프로듀서, 통역사 등","인문, 예술, 사회, 문화, 과학, 기술 등 다양한 분야의 고전을 읽고 이를 바탕으로 한 토론과 논술 활동을 전개한다. 이를 통해 희망 진로와 해당 분야에 대한 이해를 심화시킬 수 있으며, 고전이 우리 삶에 지니는 의미와 가치에 대한 이해를 높일 수 있다.","● 고전의 가치 (고전의 지혜, 성찰적 독서)
● 고전의 수용 (정전으로서의 고전, 고전과 교양)
● 고전과 국어 능력 (고전의 표현 방법, 국어문화)
● 고전과 삶 (고전과 인성, 고전 읽기의 생활화)",성취도 3단계/등급 미산출
수학Ⅰ,일반선택,"공통과목인 ‘수학’을 학습한 후 더 높은 수준의 수학을 학습하기를 원하는 학생들이 선택할 수 있는 과목이다. 지수로그함수, 삼각함수, 수열 3개의 핵심 개념 영역을 학습함으로써 수학의 규칙성과 구조의 아름다움을 음미하고, 수학의 지식과 기능을 활용할 수 있다.",수능 필수,없음,"사회과학계열, 자연과학계열, 공학계열 학과 전체","경제학자, 통계학자, 지리학자, 물리학자, 천문학자, 생명과학자, 대기과학자, 건축가, 전기전자공학자, 화학공학자, 기계공학자, 에너지공학자, 파일럿, 항해사, 음향전문가 등","지수함수와 로그함수는 다양한 자연현상을 해석하는 데 많이 쓰인다. 생태계의 종의 개체 수, 소리의 크기, 방사성 동위 원소의 잔류량 등은 지수함수나 로그함수로 표현할 수 있다. 삼각함수는 고대의 삼각법에서 기원한 학문으로서 천문학과 항해술의 발전에 크게 기여하였고 수열은 수의 규칙성을 관찰하는 것뿐만 아니라 미적분 과목의 수열의 극한과도 연결되며 미적분학의 기초 개념으로 활용된다. ","● 해석 (지수와 로그, 지수함수와 로그함수, 삼각함수)
● 대수 (등차수열과 등비수열, 수열의 합, 수학적 귀납법)",성취도 5단계/등급 산출
수학Ⅱ,일반선택,"사회 및 자연 현상을 이해하기 위한 수학적 개념인 함수의 극한과 연속, 미분, 적분에 관련된 원리와 법칙에 대해 학습하는 과목이다. 이를 통해 수학 문제뿐만 아니라 실생활과 다른 교과의 문제를 창의적으로 해결하는 능력을 기른다.",수능 필수,없음,"사회과학계열, 자연과학계열, 공학계열 학과 전체","경제학자, 통계학자, 물리학자, 화학자, 생명공학자, 전기전자공학자, 화학공학자, 기계공학자, 컴퓨터공학자 등","‘수학’ 교과에서 다뤘던 함수의 개념에 극한과 연속의 개념을 더하여 학습하게 된다. 미분법은 움직이는 모든 현상을 함수로 표현해 수학적으로 설명하고자 하는 개념이고 적분법은 도형의 넓이와 입체의 부피를 구하는 방법이다. 공학 분야 전반에서 사용되어 공학 수학의 기초가 되며, 물리적 현상뿐 아니라 경제학의 모형분석 등 함수를 이용하는 모든 학문에 사용된다.","● 해석 (함수의 극한, 함수의 연속, 미분계수, 도함수, 도함수의 활용, 부정적분, 정적분, 정적분의 활용)",성취도 5단계/등급 산출
미적분,일반선택,"일반선택과목인 ‘수학Ⅰ’, ‘수학Ⅱ’를 이수한 후 선택할 수 있는 과목이다. 사회 및 자연 현상을 수학적으로 관찰하고 표현하며 분석하는 학문인 미적분학을 ‘수학Ⅱ’에 이어 심화 학습한다. 자연과학, 공학, 의학 분야와 함께 경영, 경제학을 포함한 사회과학 분야에 활용된다.",수능 선택,없음,"사회과학계열, 자연과학계열, 공학계열 학과 전체","수학자, 경제학자, 통계학자, 물리학자, 화학자, 생명공학자, 전기전자공학자, 화학공학자, 기계공학자, 컴퓨터공학자 등","‘수학Ⅱ’에서 다루었던 다항함수에 대한 미적분의 영역이 ‘미적분’과목에서는 더욱 다양한 사회 및 과학 현상에 접목될 수 있도록 지수함수, 로그함수, 삼각함수의 영역까지 미적분의 개념이 확장된다.","● 해석 (수열의 극한, 급수, 여러 가지 함수의 미분, 여러 가지 미분법, 도함수의 활용, 여러 가지 적분법, 정적분의 활용)",성취도 5단계/등급 산출
확률과 통계,일반선택,"데이터 중심의 현대 정보화 사회에서 데이터를 이해하고 활용하는 기본 소양을 기르는 과목으로, 사건이 일어날 가능성을 수치화한 확률뿐 아니라 자료를 수집, 정리, 해석하는 통계에 대해 학습한다. 자연, 공학, 의학, 경영, 경제학을 포함한 사회과학, 인문학, 예술 및 체육 등 다양한 분야에서 활용된다.",수능 선택,없음,"사회과학계열, 자연과학계열, 공학계열 학과 전체","경제학자, 통계학자, 데이터과학자, 대기과학자, 임상의학연구원, 신약개발연구원, 애널리스트, 보험계리사, 스포츠기록분석원 등","‘확률과 통계’는 ‘수학I, Ⅱ’의 내용을 이해한 학생이 배우는 것이 바람직하나 이수하지 않은 학생도 선택할 수 있다. 일상생활에서 의사 결정의 합리적인 선택을 위해서 적용되며 강수확률, 스포츠 경기의 승률, 여론 조사 등에 널리 쓰인다. 자연과학, 공학, 의학뿐 아니라 인문사회, 예체능 등 다양한 분야의 연구에서 관련 개념이 핵심적으로 사용된다.","● 확률과 통계 (순열과 조합, 이항정리, 확률의 뜻과 활용, 조건부 확률, 확률분포, 통계적 추정)",성취도 5단계/등급 산출
실용 수학,진로선택,"규칙, 공간, 자료에 대해 학습함으로써 수학이 실생활의 다양한 분야에서 어떻게 활용되는지 이해하고 수학을 활용하여 실생활 문제 해결 방법을 학습하는 과목이다. ",수능 출제 과목 아님,없음,"사회과학계열, 자연과학계열, 공학계열 학과 전체","사회, 과학 전반 활동 분야",구성 내용과 수준이 높지 않다. 수학이 실생활에 어떻게 활용되는지 배울 수 있고 생활 주변에서 접하는 여러 가지 문제를 해결하는 능력을 키울 수 있다.,"● 해석기하 (식과 규칙, 도형과 규칙)
● 기하 (도형의 관찰, 도형의 표현)
● 통계 (자료의 정리, 자료의 해석)",성취도 3단계/등급 미산출
기하,진로선택,"공통과목인 ‘수학’의 좌표평면, 도형의 방정식의 내용을 바탕으로 이차곡선, 평면벡터, 공간도형과 공간좌표에 관하여 학습하며 기하학적 관점에서 심화된 수학 지식을 이해하고 활용하도록 하는 과목이다. ",수능 선택,없음,"경제학과, 통계학과, 지리학과, 물리학과, 지구과학과, 건축학과, 기계공학과, 전자공학과, 조선해양공학과, 항공운항과, 산업디자인학과 등 ","수학자, 건축가, 기계/자동차공학자, 전자공학자, 컴퓨터공학자, 항공 및 해양 관련 분야, 물리천문학자, 지리학자, 산업디자이너 등","오늘날 위성안테나, 자동차의 전조등, 망원경은 이차곡선의 성질을 활용하여 만든 대표적인 장치이다. 벡터는 어떤 물체에 작용하는 힘이나 속도 등 그 방향과 크기를 동시에 표기해야 의미가 있는 분야에 활용된다. 공간도형의 개념은 건축설계 및 기계제작, 견고해야 하지만 가벼워야 하는 비행기 제작 등에 이용된다. 수학, 물리, 천문, 지구과학, 건축, 기계, 항공, 전기전자, 컴퓨터 등 공간지각능력이 필요한 분야에 진학하고자 하는 학생은 필수적으로 학습해야 할 교과이다.","● 해석 (이차곡선, 벡터의 연산, 평면벡터의 성분과 내적, 직선과 평면, 정사영, 공간좌표)",성취도 3단계/등급 미산출
경제 수학,진로선택,‘수학Ⅰ’을 이수한 후 배울 수 있는 과목이다. 수학의 지식과 기능을 활용하여 실생활에서 접할 수 있는 경제 및 금융의 기본 개념을 이해할 수 있다.,수능 출제 과목 아님,없음,"경영학과, 경제학과, 통계학과, 금융수학과 등","회계사, 세무사, 보험계리사, 자산관리사, 감정평가사, 은행원 등","오늘날의 경제학은 수학과 밀접한 관계가 있다. 경제 지표나 환율, 세금에 대한 개념을 학습하고 수열의 개념을 활용한 원리합계의 개념을 익힐 수 있다. 또한 함수가 경제 지표를 어떻게 표현하고 있는지를 학습할 수 있으며, 미분이 경제학에 어떻게 쓰이는지 경험할 수 있다. 단, ‘미적분’에서 다루는 지수함수와 로그함수의 미분은 다루지 않는다. ","● 대수 (경제지표, 환율, 세금, 이자와 원리합계, 연속복리, 연금)
● 해석 (함수와 경제현상, 함수의 활용, 미분, 미분과 경제문제)",성취도 3단계/등급 미산출
수학과제 탐구,진로선택,"수학과제 탐구 방법을 익히고 자신의 관심과 흥미에 맞는 수학과제를 선정하여 탐구하는 과목이다. 수학과제 탐구의 목적과 절차, 연구 윤리를 학습하고, 이를 토대로 이전에 학습한 수학 내용을 더 깊이 탐구하거나 다른 교과와 수학을 융합한 흥미로운 주제를 선택하여 탐구한다.",수능 출제 과목 아님,없음,"사회과학계열, 자연과학계열, 공학계열 학과 전체","사회, 과학 전반 활동 분야","수학과제 탐구의 필요성을 이해하고 그 방법을 습득하여 자신의 관심과 흥미에 맞는 탐구과제를 선정하여 학습하는 과목이다. 이러한 능력은 자연과학, 공학, 의학, 경제/경영학을 포함한 사회과학, 인문학, 예술 및 체육 분야를 학습하는 데 기초가 된다. ","● 과제 탐구의 이해 (수학과제 탐구의 의미와 필요성, 과제 탐구 방법과 절차, 연구 윤리)
● 과제 탐구 실행 및 평가 (탐구 주제 선정, 탐구 계획 수립, 탐구 수행, 탐구 결과 정리 및 발표, 반성 및 평가)",성취도 3단계/등급 미산출
인공지능 수학,진로선택,4차 산업혁명의 핵심 분야 중 하나인 인공지능을 이해하고 활용하기 위한 과목이다. 인공지능과 관련된 수학적 지식과 함께 인공지능이 자료를 수학적으로 표현하고 분류하고 예측하며 최적화를 통해 합리적으로 의사결정 하는 과정에 대해 학습한다.,수능 출제 과목 아님,,"AI융합학부, AI학과, 인공지능학과, 컴퓨터공학과, 정보통신공학과, 산업공학과, 데이터과학과, 통계학과, 언어학과 등","데이터과학자, 소프트웨어 개발자, 사물인터넷 및 가상현실 전문가, 인공지능 접목 분야(의료, 과학, 통계, 경영, 금융 등) 연구원 등","4차 산업혁명의 핵심 기술 중 하나인 인공지능 기술은 얼굴을 인식해 카메라의 초점을 자동으로 잡아주고, 인터넷 검색에서 사용자에 따라 자동으로 추천검색어를 띄워주는 등 이미 실생활에 접목되고 있으며 앞으로도 이를 통해 다양한 분야에서 혁신과 변화가 가속될 것으로 예측되고 있다. 이 과목은 인공지능의 기본적인 원리를 이해하고 활용하기 위한 기초 소양을 제공한다.","● 인공지능과 수학(인공지능과 관련된 수학)
● 자료의 표현(텍스트 자료의 표현, 이미지 자료의 표현)
● 분류와 예측(자료의 분류, 경향성과 예측)
● 최적화(최적화와 의사 결정)",성취도 3단계/등급 미산출
영어 회화,일반선택,"실생활이나 학업과 관련한 상황에서 자주 사용하는 영어 표현을 학습하고, 자신의 생각이나 의견을 적절하게 표현하는 영어 의사소통 능력을 기른다. ",수능 출제 과목 아님,"TOEFL, TOEIC, IELTS, TEPS, OPIc 등","항공서비스학과, 호텔경영학과, 비서행정학과, 관광통역과, 국제관계학과 등","승무원, 호텔리어, 교수, 관광통역사, 외교관, 언론인, 교사 등","영어 과목 중 가장 학습 부담이 적은 과목으로, 다양한 듣기, 말하기 활동을 통해 의사소통 능력을 기를 수 있다. 관광 산업, 통역, 서비스 직종 등 외국인과의 원활한 소통이 요구되는 진로를 희망하는 학생들이 수강하면 좋은 과목이다.","● 듣기 (세부정보, 중심내용, 맥락)
● 말하기 (담화)",성취도 5단계/등급 산출
